Keyword;Choices;Recipes;;
;Sour Cream;1. Place roast beef in saucepan and mash with fork 2. Mix in green chiles , garlic powder , chili powder , ground cumin , , beef broth and wondra flour 3. Bring to boil and simmer 2 minutes 4. Place refried beans in a microwave safe bowl , cover with plastic wrap and heat in microwave about 2 - 3 minutes or until heated through 5. Heat tortillas separately over open flame on stove , turning frequently until heated through or heat on griddle or frying pan , turning once 6. Place warmed tortilla on plate and spread with refried beans 7. Remove a serving of beef from saucepan with slotted spoon and place over refried beans 8. Top with shredded cheese 9. Fold sides of tortillas in about 2 inches 10. Roll the burrito , starting with the side closest to you and roll away from you 11. Ladle some beef & green chile sauce over burrito and top with cheese 12. Garnish with a dollup of sour cream;;
;Cheddar Cheese;1. Cook onions , carrots and garlic in cooking oil until tender-crisp 2. In a large deep skillet , brown meat and drain fat 3. Add cooked vegetable mixture and seasonings to cooked meat 4. Cook and stir 1 minute 5. Add remaining ingredients except for cheese 6. Bring to a boil , reduce heat to low and simmer for 20 minutes , stirring occasionally 7. Serve topped with cheese;;
Corn;Milk;1. Preheat broiler 2. Combine all ingredients , except butter and flour 3. Bring to a boil 4. Reduce heat and simmer 5 minutes 5. Blend melted butter with the flour to make a roux 6. Add roux to the corn and mix well 7. Remove from heat 8. Pour into a casserole dish 9. Sprinkle with parmesan cheese 10. Broil until cheese is nicely browned;;
;Cayenne Pepper;1. Mix together the corn , sour cream , and mayonnaise 2. Slice the lime in half and squeeze the juice from one half over corn mixture 3. Mix well 4. Chop the cilantro and green onions 5. Add to the corn mixture 6. Blend in the cumin and cayenne pepper 7. Mix in shredded cheese 8. Refrigerate overnight 9. Serve with tortilla chips;;
;Lemon Juice;1. In a two quart saucepan with tight-fitting lid , heat one tablespoon of the olive oil , then saute the onion over medium heat until very golden and soft 2. Add the garlic and ginger and cook for a minute , then add the paprika , black pepper , allspice and cayenne and cook for a minute more 3. Wash the millet quickly and drain 4. Add the millet to the pan and stir , coating the grains and cooking until hot to the touch 5. Add the water and salt and bring to a boil , then reduce the heat and cover 6. Simmer on low for 20 minutes before checking for doneness 7. When all the liquid is absorbed and the grain is tender , cover and take the pan off the heat for 10 minutes to steam 8. Scrape the cooked millet into a bowl and cover , then let cool 9. Whisk the remaining two tablespoons olive oil with the lemon juice and brown sugar in a small bowl 10. Stir the corn , bell pepper , tomato and parsley into the cooled millet mixture , then drizzle the dressing over it and stir to coat 11. Serve topped with the peanuts;;
;Black Pepper;1. Fry bacon in a dutch over until crisp 2. Remove bacon , reserving 2 tablespoons drippings 3. Crumble bacon and st aside 4. Saute onion in reserve drippings until tender 5. Add potatoes and water 6. Cover and simmer 15 to 20 minutes or until potatoes are tender 7. Stir in milk , corn , salt , and peper to taste 8. Continue to cook , stirring frequently , until heated through 9. Sprinkle with crumbled bacon to serve;;
;Corn Tortillas;1. Make enchilada gravy sauce 2. Heat oil in large stockpot 3. Add flour and cook until browned , stirring constantly , you are making a roux , do not let it burn 4. Stir in chili powder , cumin , garlic , salt and pepper 5. Cook roux , stirring constantly , for at least 2-3 minutes 6. If you do not thoroughly cook the roux it will taste like flour mixed with oil 7. Gradually add the water , stirring until smooth 8. Boil gently for 15 minutes 9. Meanwhile make the chili con carne 10. Brown the ground beef in a large skillet 11. Add the garlic , cumin , bay leaf , salt and pepper 12. Cook for 15 minutes , stirring occasionally and adding a little water if the pan becomes dry 13. Add the chili powder and 1 cup of water and bring to a simmer 14. Simmer for 10 minutes , then remove the bay leaf and add the beans if using 15. Meanwhile make the enchiladas 16. Preheat oven to 350f 17. Soften tortillas , fill with american cheese and roll up 18. Place them seam side down in a baking dish and cover with enchilada gravy sauce and chili con carne 19. Top with pico de gallo and more cheese to taste 20. Heat in oven for 10 minutes or until cheese is melted and enchiladas are heated through;;
Crabs;Tabasco Sauce;1. Blend cream cheese and mayo until creamy 2. Add lemon juice , tabasco , and scallions 3. Mix 4. Add old bay , salt , pepper and crab meat 5. Mix 6. Put in baking dish and top with parmesan cheese 7. Bake at 350 degrees for 30 to 40 minutes , until cheese starts to brown 8. Can be refrigerated up to 24 hours before cooking;;
;Heavy Cream;1. Preheat oven to 350 degrees 2. Grease an 8 inch square pan 3. Layer 4 of the quartered tortillas covering the bottom of pan completely 4. Combine peppers , crab , 1 c 5. Cheese , onion , and the cilantro 6. Whisk together cream and eggs: stir into crab mixture 7. Add salt and pepper to taste 8. Pour over tortillas 9. Top with remaining quartered tortillas and remaining cheese 10. Bake for 45 minutes;;
;Milk;1. Bring milk , half and half , and heavy whipping cream to a boil 2. Add crab meat , fresh parsley , old bay seasoning , butter , salt and pepper 3. When it starts to boil , make a paste of cornstarch and water and add to thicken soup 4. To serve , sprinkle each serving with a bit of old bay and chopped parsley 5. Serve with oyster crackers and a small cream pitcher of sherry on the side for diners to add to taste;;
;Fresh Lemon Juice;1. Heat oil and butter in large skillet over medium heat 2. Add garlic and cook until garlic is lightly golden 3. Add red pepper , lemon juice and white wine 4. Bring to a soft boil and simmer for 2-3 minutes 5. Gently stir in crabmeat and parsley 6. Season with salt and pepper to taste 7. Serve over pasta 8. Save about 1 / 2 to 1 cup of pasta water to add to dish if there is not enough liquid to suit you or you could also add additional amount of wine or chicken broth;;
;Dijon Mustard;1. Combine lemon dill sauce ingredients and chill 2. Saute the scallions , garlic , and parsley in a tablespoon of melted butter over medium heat until wilted 3. In a large mixing bowl , combine the eggs , worcestershire sauce , dijon mustard , salt , pepper , 1 / 2 cup cracker crumbs , grated parmesan , and mayonnaise 4. Fold in the crabmeat 5. Shape into 8 crab cakes and coat in remaining cracker crumbs 6. Place crab cakes on a buttered baking pan 7. Melt butter and mix with lemon juice 8. Drizzle 1 / 2 of lemon butter over crab cakes 9. Bake for 20 minutes at 350 degrees 10. Drizzle remaining lemon butter over crab cakes and broil for 2 minutes until slightly browned 11. Serve with lemon dill sauce;;
Egg;flour;"1. In a pot , cover carrots with water to cover 2. Bring to a boil , then lower heat 3. Simmer 10 minutes or until just tender 4. While simmering carrots , pour contents of can of tomatoes into a bowl and squish into little pieces with your hands 5. Wash hands 6. Blend chili powder , cumin , oregano , and cayenne into tomatoes 7. Take the 2 tbs of flour and blend with 1 / 4 cup cold water in a small cup 8. Pour this into tomato mixture and stir to blend 9. Drain carrots , and cut into 3 / 4 in pieces 10. Put both aside for now 11. Melt butter on medium heat in a large fring pan 12. Add onion , mushrooms , zucchini , celery , green pepper , and garlic and saute 13. Stir continuously until onion is limp 14. Stir tomato mixture into frying pan and bring to a simmer 15. Cover and simmer for 2 or 3 minutes , then uncover and cook for about 5 minutes over med-high heat until liquid has evaporated 16. Stir in carrots and cheese 17. Salt to taste 18. When cheese has melted put pan in refrigerator to quickly cool vegetables 19. Stir now and then to help cool faster 20. Now , begin empanada crust 21. Resift flour with baking powder in a bowl 22. Quickly cut butter and shortening into bowl until it looks like a coarse meal 23. Make a well in the center 24. Add soy sauce and cold water together 25. Stir vigorously with a fork until dough follows the fork around bowl 26. Personal observation: the dough seems rather""frothy"" at this point 27. Turn dough onto a lightly floured surface and knead gently for about 10 folds to remove stickyness 28. Divide dough into 8 equal pieces 29. Make into a ball and roll into an 8 inch circle 30. Spoon about 3 / 4 cup vegetable filling onto center of circle 31. Moisten edges of circle with water and bring together at top , pinching and fluting edges 32. Mine looked like balls of dough and turned out fine 33. Lift empanada onto ungreased cookie sheet 34. Repeat until done 35. If you fill more than one cookie sheet put the full one in the refrigerator 36. When done , prick the top of each empanada with a fork and brush with egg and water mixture 37. If you are going to cook some of them right away , pre-heat oven to 400 and cook 25 to 30 minutes on an ungreased cookie sheet 38. Take the ones for later and freeze uncovered on cookie sheet overnight 39. When frozen solid wrap in foil or put in freezer bags 40. Label with instructions: bake uncovered in pre-heated 425 degree oven for 30 minutes 41. Let cool some before serving";;
;milk;1. Beat the eggs lightly and add the milk 2. Combine the flour , sugar and salt 3. Stir the flour mixture into the egg mixture , stirring in the cup of cream as you mix 4. Fry the apple slices in butter in a skillet 5. Preheat oven to 500 degree 6. Cover the bottom of an oven-proof baking dish , or heavy skillet , with apples 7. Pour the batter over slices and bake in a preheated 500 oven 8. When nearly done , remove from oven and sprinkle here and there with a mixture of sugar and cinnamon to taste 9. Place dabs of butter on the pancake and return to oven until browned 10. Just before serving , sprinkle with lemon juice , and cut into triangles;;
;vanilla;1. Cook's 2. Preheat the oven to 350 degrees f 3. Grease 2 round cake pans 4. As the oven preheats , begin to make the cake batter 5. Dissolve the cocoa into the espresso 6. Stir the buttermilk into the cocoa mixture and set aside to cool 7. Whisk together the flour , baking soda and salt 8. In another bowl , beat the butter with an electric mixer at medium speed for about 6 minutes , while gradually adding the sugar 9. The butter mixture should be light and fluffy 10. Slowly add the eggs and vanilla to the butter , while continuing to beat 11. Be sure to scrape down the sides of the bowl as you go , so all the ingredients get incorporated 12. Fold the flour and cocoa mixtures into the butter mixture with a rubber spatula , alternating from flour to cocoa in the following order: 1 / 3 flour mixture 13. 1 / 2 cocoa mixture 14. 1 / 3 flour mixture 15. 1 / 2 cocoa mixture 16. 1 / 3 flour mixture 17. Do not overmix ! 18. Pour half of the finished batter into each of the cake pans and level the tops with the spatula 19. Bake for 30-40 minutes in the center of the oven , rotating halfway through 20. Check with a wooden toothpick for doneness 21. Cool for at least 15 minutes before inverting onto a baking rack to cool completely 22. Make the buttercream: with an electric mixer beat the peanut butter and butter in a large bowl until creamy 23. Add the powdered sugar and beat until spreadable 24. With a serrated knife halve the two layers making 4 25. Place 1 cake layer top down on the rack and spread 1 / 3 of the buttercream to the edges of the layer 26. Top the first cake layer with another and repeat with the buttercream 27. Continue layering with the remaining layers and buttercream , ending with cake 28. Refrigerate covered in plastic wrap for at least 3 hours and up to overnight 29. Remove the cake from the refrigerator and carefully transfer to a wire rack over a sheet pan 30. To make the ganache , chop the butter and scatter it into the chocolate pieces in a large bowl 31. Heat the cream and corn syrup in a saucepan over moderate heat 32. As soon as the cream mixture begins to boil , pour it over the chocolate mixture and begin stirring vigorously 33. When the chocolate has melted and is combined thoroughly with the cream , stir in the vanilla 34. Quickly begin pouring the ganache over the top of the cake , allowing it to flow down and cover the sides 35. Pack the chopped peanuts onto the ganache to cover the sides of the cake , leaving the chocolate on top exposed 36. Store in the refrigerator 37. Serving suggestions: i like to reserve a little of the buttercream and a handful of whole honey roasted peanuts to decorate the top of the cake 38. Try using a star 39. Then , set peanuts into the buttercream border to form an interesting design;;
;nutmeg;1. Preheat the oven to 200 celsius / 395 fahrenheit 2. Rinse the corn in cold water 2-3 times and drain 3. Puree corn , apple juice and 1 egg until smooth 4. The puree will smell strongly of corn , but don't worry 5. The cake won't taste like this 6. In a blender , whisk egg whites until very stiff 7. Meanwhile , transfer the corn to a bowl and add oats 8. Add baking powder , vanilla and spices to the corn / oat mixture and stir very well 9. The dough will have a thick oatmeal-like texture 10. If you want , you can add 1 tsp of peanut butter for extra flavour 11. Cut the banana into coins and each coin into approximately 6 pieces 12. Chop the walnuts 13. Add banana and walnuts to the corn / oat mixture 14. Use a big flat spoon and scoop an amount equal of 4 tablespoons of the very stiff egg whites into the corn / oat mixture and stir until even 15. Add the corn / oat mixture to the remaining egg whites , but don't stir until even 16. Just mix lightly 17. There will be puffs of egg white here and there 18. Add baking sheets to a 10x20 square baking tray or any other equally sized heat resistant tray you may have in handy 19. Pour the thick mixture into the tray and bake for 15 minutes 20. Done ! your fluffy , spicy , moist , sweet , delicious and incredibly healthy cake is ready !;;
;apples;1. Preheat oven to 350f spray an 8x8 inch non-stick cake pan with cooking spray 2. In a medium mixing bowl , using a sturdy whisk or spatula , mix the applesauce , vanilla , egg whites and sugar until they are well combined 3. Add the flour , cocoa powder , espresso powder , baking powder , and salt 4. Stir the until just combined and no lumps remain 5. Pour into prepared pan 6. Sprinkle the chocolate chips chips evenly over the top 7. Bake for 20-22 minutes or until a toothpick inserted in the center comes out dry 8. Transfer the pan to a cooling rack and allow them to cool 5 minutes 9. Cut into 12 equal brownies;;
Eggplant;tomatoes;1. Preheat oven to 350 dg 2. Peel eggplants , slice , sprinkle lightly with garlic salt and set aside about 15 minutes on paper towels 3. Saute onion in 1 t butter or oil , add ham and wine , and cook until wine nearly evaporates 4. Add tomatoes and simmer 10 minutes 5. Meanwhile , pat eggplant dry , dust with flour and fry in 2 t butter or oil until golden 6. Drain 7. Layer eggplant , then a portion of ham mixture , another layer of eggplant , etc 8. In greased casserole dish and cover with parmesan cheese 9. Bake at 350 dg 10. For 30 minutes;;
;zucchini;1. Butter a large baking dish 2. Set aside 3. Sprinkle both sides of eggplant slices with salt 4. Let stand 1 hour 5. Rinse and pat dry with paper towels 6. In buttered dish , arrange eggplant slices , potatoes , zucchini , dill and parsley 7. Preheat oven to 350f 8. Heat oil in a medium skillet 9. Add onion and garlic , saute until transparent 10. Stir into eggplant mixture 11. Stir in salt , pepper , and broth 12. Cover and bake 45 minutes 13. In a small bowl , combine breadcrumbs and 1 tbsp cheese 14. After baking eggplant mixture 45 minutes , stir tomatoes and crumb mixture into vegetable mixture 15. Bake 15 minutes longer or until tomatoes are cooked 16. Sprinkle with remaining cheese 17. Serve hot;;
;mozzarella cheese;"1. For sauce : 2. In a dutch oven or large size sauce pan , add oil , on medium heat 3. Add garlic and onions , saut' until tender 4. Add tomato sauce , tomato paste , and wine , if using , and italian seasoning 5. Mix well , and bring to a boil , then reduce heat to a simmer 6. Cover and simmer for 4 4 1 / 2 hours , stirring occasionally 7. For eggplant: 8. In a large size skillet , add olive oil 9. Heat on medium 10. Peel eggplant , then slice them into 1 / 4"" round disks 11. In two small bowls or pie plates , add bread crumbs to one , and eggs and milk to the other , beat egg mixture well 12. Dip each eggplant disk into egg mixture then into bread crumbs , coat completely 13. Place gently into hot oil 14. Fry to a golden brown on both sides , drain on paper towels 15. Repeat until all the eggplant are breaded and fried to a golden brown 16. Set aside 17. Preheat oven to 350 degrees f 18. Assemble: 19. In a 13x9x2 ungreased baking dish , add about 1 to1 cups sauce to bottom of pan , spread sauce evenly in baking dish 20. Cover sauce with one even layer of breaded eggplant , spread 1 cup mozzarella cheese evenly over eggplant , sprinkle with 1 / 3 cup parmesan cheese 21. Repeat two more times , ending with parmesan cheese 22. Bake uncovered for 45 minutes 23. Let set for 10 minutes before cutting 24. Cut into 8 pieces 25. Serve hot";;
;flour;1. Place the pepper and the sliced onion on foil lined baking sheet 2. Spray the onions with a tiny bit of garlic flavored cooking spray 3. Broil until peppers' skin is blackened 4. Let cool and peel the peppers 5. In the meantime , grill the zucchini on george forman grill until it has black marks 6. Set aside 7. Brush the eggplant slices with marinade and place on grill , cook until it has black marks on it 8. Chop all vegetables into bite sized pieces 9. Spray a large skillet with garlic no stick cooking spray 10. Heat to medium 11. Place one of the tortillas in the skillet to soften 12. Layer half of ingredients in tortilla , roll up and and place in skillet 13. Brown on all sides and serve with 2 tablespoons fat free sour cream 14. Repeat with remaining ingredients 15. Enjoy;;
;eggs;1. Preheat oven to 375 degrees 2. Brush 2 baking sheets with oil 3. Set aside 4. In a wide , shallow bowl , whisk together eggs and 2 tablespoons water 5. In another bowl , combine breadcrumbs , 3 / 4 cup parmesan , oregano , and basil 6. Season with salt and pepper 7. Dip eggplant slices in egg mixture , letting excess drip off , then dredge in breadcrumb mixture , coating well 8. Place on baking sheets 9. Bake until golden brown on bottom , 20 to 25 minutes 10. Turn slices 11. Continue baking until browned on other side , 20 to 25 minutes more 12. Remove from oven 13. Raise oven heat to 400 degrees 14. Spread 2 cups sauce in a 9-by-13-inch baking dish 15. Arrange half the eggplant in dish 16. Cover with 2 cups sauce , then 1 / 2 cup mozzarella 17. Repeat with remaining eggplant , sauce , and mozzarella 18. Sprinkle with remaining 2 tablespoons parmesan 19. Bake until sauce is bubbling and cheese is melted , 15 to 20 minutes 20. Let stand 5 minutes before serving;;
Fish;coconut milk;1. Read the method from start to finish and then choose and prep your ingredients 2. Curry base: shake the can of coconut milk or stir it well 3. In a 3-4 qt saucepan or wok over medium heat , simmer 1 / 2 cup of coconut milk , stirring occasionally until reduced by half 4. It will get very thick and shiny and may or may not separate-either is fine 5. Add your choice of curry paste , whisk well and cook , continuing to whisk , for 1 minute 6. Whisk in the broth and the remaining coconut milk 7. Bring to a simmer over medium-high heat 8. Aromatics / simmer: add your choice of aromatics , proteins , vegetables and fruits as well as the brown sugar and fish sauces to the simmering sauce 9. Be aware that some ingredients take longer than others to cook 10. Add the ingredients in stages , as listed in the next step 11. When the aromatics are added , also add your choices of chicken , pork , carrots , onions , eggplant , green beans , chinese long beans and kabocha squash 12. Two minutes later , add your choices of beef , large shrimp , tofu , asparagus , mushrooms , baby corn , green papaya , cabbage , bell peppers , and sugar snap peas 13. One minute later , add your choices of scallops and firm white fish 14. One minute later , add your choice of squid , cherry tomatoes , bamboo shoots , snow peas , pineapple and bok choy 15. Cook for one to two minutes more and check for doneness 16. The meat , chicken or seafood should be cooked through and the vegetables should be tender-crisp 17. Remove the curry from the heat and season to taste with the brown sugar and fish sauce 18. Add a stir-in of your choice 19. Transfer to a serving bowl or serve right from the pot 20. Remove the aromatics before serving or tell the guests to eat around them 21. Serve with your choice of garnishes 22. The curry can be eaten as is or served with hot cooked rice;;
;tomatoes;1. After soaking the cod , remove from the water and dry well with a kitchen towel 2. Peel your onions and slice them into half moons also peel the garlic and chop it up 3. Under hot water remove the tomatoes skins and slice them up 4. In a rectangle casserole dish place in 1 / 2 of the olive oil and1 / 2 of the wine 5. Spread the onions , garlic , sliced tomatoes bay leaf , and the potatoes 6. Now place the cod over top of everything and drizzle the remaining wine and olive oil over each fillet 7. Keep basting the cod with the remaining olive oil so as not to dry out on you 8. Bake at 380f for about 1 hour or when potatoes are cooked 9. Remove from oven and sprinkle with parsley (serve with a green tossed salad , and enjoy;;
;flour;1. Heat the olive oil in a large frying pan 2. Add the garlic and lightly brown , but be careful not to burn ! 3. Add the flour , and whisk to combine 4. Mix in the wine and stock 5. Add the clams , cover and cook until the clams open , 6. Add the artichoke hearts , and continue to cook until they are heated through 7. Serve immediately;;
;cilantro;1. For the avocado cream: place all ingredients into a food processor and give it a whirl until smooth 2. Cover with plastic wrap and refrigerate until ready to use 3. Good for one week refrigerated 4. For the salsa: place half of canned tomatoes into food processor 5. Add half of the jalapeno , seeds and all 6. Add the rest of the salsa ingredients 7. Whirl until smooth 8. Taste 9. If youd like more heat , add the rest of the jalapeno pepper and process until smooth 10. Pour into mixing bowl and add the rest of the canned tomatoes 11. Mix and taste 12. Season with more salt if necessary 13. Refrigerate up to two weeks 14. For the rub: mix all rub ingredients together in a small bowl 15. Brush fish fillets with oil 16. Coat both sides of fish generously with the rub 17. Heat a non stick pan over medium-high heat with oil 18. Cook fish in the hot pan , do not crowd , for 4 minutes per side 19. Remove from heat onto a platter , flake with a fork 20. Squeeze fresh lime juice over fish 21. Cover with foil to keep warm 22. Wipe out fish pan and warm tortillas one minute per side in the pan and place into a bowl lined with a clean napkin or kitchen towel to keep warm 23. Layer over warm tortilla 24. Lettuce , tomato , cheese , fish , avocado cream , and salsa;;
;eggs;1. Melt butter in a skillet over medium heat 2. Saute green onions and bell pepper for 4-5 minutes or until tender 3. Add in crawfish 4. Saute for 1 minute or so until light pink 5. Combine eggs , milk , and cajun seasoning / hot sauce to taste in a bowl 6. Add to skillet 7. Scramble until desired doneness is achieved 8. Add more cajun seasoning if necessary 9. Serve immediately;;
Lamb;tomatoes;1. In medium size bowl whisk together 1 tbsp olive oil , rosemary , oregano , pepper , salt 2. Rinse and pat dry lamb chops , place in bowl , turning to coat with seasoning mix 3. Let marinate at least 15 min and up until 6 hrs in fridge 4. Place chops in a casserole dish and bake in oven for 30 min at 350 degrees 5. You may need to check and add a small bit of water to pan so chops do not stick or burn on bottom 6. Check to see if all pink is cleared , place sliced tomatoe and sliced mozzerella on top of chop in order stated , use additional pepper to taste and bake for 5 more minutes 7. Remove from oven and let sit for 5 minutes so juices can set and meld into meat 8. Serve with a crusty loaf of bread and your favorite sides 9. You may also choose to add red pepper flakes for heat i used 1 / 2 tsp on 2 chops , sprinkled after in oven 10. Thickness of chop will effect cooking time as well so if thin check after 20 minutes 11. Ovens vary so please check to be sure at the 30 min time frame;;
