Keyword;Choices;Recipes;;
Rib eye;salt and pepper;1. Soften the butter from the fridge 2. Mix the butter with chopped rosemary and pepper 3. Place the steak in a large container with the butter mixture 4. Cover and marinate in the refrigerator for at least 2 hours 5. Grill with high heat 6. Add some of the garlic and rosemary from the marinade as you grill 7. Allow the steak to rest for 5 minutes before serving;;
;beef broth;1. Heat olive oil in skillet over high heat 2. Add salt and pepper to steak 3. Place steaks in hot skillet and immediately turn down heat to medium high 4. Cook steaks for 4 minutes on each side or to your taste 5. Remove steaks to a platter and cover with foil to keep warm 6. Remove skillet from heat and add butter and garlic 7. Return to heat and add mushrooms and saute until done 8. Add flour and cook for about a minute 9. Decrease heat to medium low 10. Then add wine and broth 11. Bring to a boil 12. Stir constantly until thick 13. Remove pan from heat and add rosemary;;
;balsamic vinegar;1. Combine the first four ingredients in a ziploc bag or shallow pan 2. Add steaks to marinade 3. Marinate for 1-2 hours  4. Turn steaks in marinade frequently 5. Grill steaks to desire doneness 6. Grill for 3-5 minutes on each side for medium-rare / medium doneness 7. While steaks are grilling 8. Combine vinegar and blue cheese to a creamy consistency 9. Serve sauce as a condiment to steaks;;
;dijon mustard;1. First, in a blender, combine soy sauce, mustard, lemon juice, garlic, ginger, thyme, pepper, and rosemary 2. Blend until smooth 3. Brush both sides of steaks with mixture 4. Grill or broil 4 minutes on each side for medium-rare 5. Grill or broil longer for desired taste 6. Each time turn the steaks 7. Brush with sauce 8. Discard sauce after grilling / broiling;;
;blue cheese;1. Saute oysters , mushrooms , and parsley in the butter until the mushrooms are tender 2. Drain off butter 3. Stir in the bacon, cheese, and wine 4. Set them aside 5. Make a pocket in the side of the steak 6. Stuff pocket with the oyster mixture 7. Secure with wooded picks 8. Broil steaks about 6 inches from heat for about 8-10 minutes on each side or until desired doneness 9. Top steaks with any leftover oyster stuffing;;
Duck;honey;1. Preheat oven to 190c 2. Mix all the ingredients together in a small saucepan and simmer for 5 minutes 3. Reserve 1 / 4 of the glaze 4. Sit the duck on a rack over a baking dish, baste and place in oven 5. Baste the duck every 10 minutes throughout the cooking process with remaining 3 / 4 of glaze 6. A 2kg duck should take about 1 hour 15 minutes to cook, but give one of its legs a pull, and if it moves freely and any juices run clear, your duck will be cooked 7. Place on a serving platter, brush with reserved glaze and serve 8. Pass any remaining reserved glaze to be spooned over carved duck.;;
;soy sauce;1. Marinate duck in remaining ingredients for about 8 hours 2. Turn occasionally through the day 3. Heat oven to 160c / 330f 4. Remove the duck from the marinade and lay on a foil lined baking sheet 5. Bake for 2 hours or until very tender 6. You may need to pour off the fat a couple of times during the cooking time 7. Serve the duck on rice with oriental noodle salad;;
;chicken stock;1. Combine stock and water into saucepan and heat till liquid is simmering 2. Add, galangal, chillies, and lime juice to saucepan 3. Bruise lemon grass and coriander, and add to saucepan 4. Simmer liquid for 20 minutes 5. Strain liquid, and return to saucepan 6. Heat liquid with duck and shallots 7. Boil ramen noodles in separate saucepan for 3-5 minutes or till tender 8. Drain noodles 9. Add noodles and bak choy to soup stock and simmer for 5 minutes 10. Ladle soup to serving bowls, garnishing with bean sprouts, chilli strips, and coriander 11. Add salt and pepper to taste 12. Best enjoyed hot;;
;sesame oil;1. Preheat the barbeque 2. Using a sharp knife, cut a long slit in the fleshy side of each duck breast to make a pocket 3. Divide the apricots and shallots between the pockets and secure with skewers 4. Mix the honey, soy sauce, and sesame oil together in a small bowl and brush all over the duck 5. Sprinkle with the chinese five-spice powder 6. To make the garnish, make a few cuts lengthways down the stem of each scallion 7. Place in iced water and leave until the stems start to curl 8. Drain before using 9. Cook the duck over medium hot coals for 6-8 minutes on each side 10. Remove the skewers, set on a bed of cous cous and garnish with the scallion curls 11. Serve immediately;;
;chinese duck sauce;1. Place ribs in bottom of large slow cooker 2. In a large bowl, stir together teriyaki sauce, and cornstarch 3. Blend in duck sauce, and garlic 4. Pour sauce over ribs, making sure each layer is covered 5. Cover and cook on low for 8 hours, or on high for 4-5 hours;;
Clam;dry white wine;1. Peel and devein shrimp 2. Drain and flake crabmeat, removing any bits of shell 3. Set seafood aside 4. Saute onion, garlic, and celery in hot oil in a pan over med-high heat for 8 minutes, until tender 5. Stir in flour 6. Cook, stirring constantly for 1 minute 7. Stir in broth and the next 4 ingredients 8. Bring to a boil 9. Cover, decrease heat, and simmer, stirring occasionally, 30 minutes, or until potatoes are tender 10. Stir in shrimp, crabmeat, and heavy cream 11. Cook over low heat 5 minutes or just until the shrimp turn pink 12. Garnish with parsley 13. Serve;;
;bacon;1. In large 4 quart pan brown bacon, onion, and celery until onion and celery are transparent 2. Add clam juice from clams and add diced potatoes to bacon mixture 3. Pour enough water to cover potatoes and boil until potatoes are tender 4. In a separate large sauce pan, melt 2 cubes of butter on low heat 5. When butter is melted, slowly add 3 / 4 cup of flour, stirring constantly 6. Add 1 quart half and half stir with wire whisk until thick and smooth 7. Pour over undrained vegetable mixture, add vinegar and heat thoroughly 8. Season with salt, pepper, garlic powder, and onion powder to taste;;
;potatoes;1. Drain juice from clams over veggies in small pan 2. Add enough water to cover and simmer until tender 3. Meantime, melt butter, add flour & blend, stirring constantly 4. Add cream slowly & stir with wire whisk until smooth and thick 5. Add undrained veggies, clams & vinegar & heat throughly 6. Season with salt and pepper to taste;;
;shrimp;1. Transfer all ingredients into a gallon storage / freezer bag 2. Refrigerate the mixture overnight , 3. Drain excess liquid, add salt, then serve over tostadas 4. Cod & halibut work well and can be substituted for shrimp 5. I enjoy a blend with squid, baby octopus, & shrimp;;
;worcestershire sauce;1. Place lime juice in saucer or small bowl 2. Make sure top of glass will fit inside 3. Place celery salt in saucer 4. Dip glass in lime juice just to wet rim 5. Dip rim into celery salt 6. Fill glass with ice 7. Add vodka, clamato, tabasco & worcestershire sauce 8. Stir gently so as to not mar rim trim 9. Trim glass with a slice of lemon and a slice of lime 10. Pop in a hot pickled bean or hot pickled asparagus spear;;
Lobster;butter;1. Defrost the lobster tails 2. Preheat the oven to 450 degrees 3. Using kitchen shears cut down the center of top of each tail down to the base 4. Next grab each side of the shell and gently pry the shell away from the meat- leaving the meat at the base of the tail attached 5. Squeeze the shell together to close the gap and lay the meat on top of the shell 6. Gently slice the meat 3 times down the top- enough to be able to lay the meat over the sides of the shell 7. Repeat for the remaining tails 8. Place the tails in an oven safe pan and brush the top of each tail with the marinade 9. You will want to baste the tails again 2 or 3 times during the cooking process 10. Bake the tails for about 25 minutes 11. Cooking times may vary so make sure you keep an eye on the tails !;;
;white wine;1. In a large saute pan over medium heat, melt butter, and saute garlic and shallots for 2 minutes 2. Add wine, chicken broth, black pepper, and red pepper flakes and bring to a boil over medium-high heat until the liquid starts to reduce 3. Add shrimp and cook about 5 minutes until opaque 4. Add lobster and heat thoroughly 5. Reduce heat to simmer, add cream and turn off heat after 1-2 minutes 6. Meanwhile, cook pasta according to package directions 7. Drain 8. Remove seafood from sauce and set aside 9. Toss pasta with sauce 10. Place seafood on top of pasta, sprinkle with parsley and serve;;
;heavy cream;1. In a large dutch oven, melt the butter and then saute the onions and celery over medium heat, allow to soften, about a few minutes 2. Add the potato and add only enough chicken broth to barely cover 3. Cook until the potato is just barely tender 4. Add the basil, oregano  celery salt, pepper, salt, paprika, and tabasco sauce 5. Layer the fish and shellfish on top 6. Add just enough chicken broth to cover 7. Cook only until fish barely flakes 8. Add the cream, and then fill the pot with the milk 9. If there is no room in the pot , skimp on the milk , not the cream 10. Allow the chowder to warm throughly 11. Keep on a bare simmer until serving or refrigerate and slowly heat up before serving 12. Movita boucoup recommends using at least two, 1 / 2 pound of each seafood selection in addition to the white fish 13. She strongly recommends scallops and lobster 14. Dont use any fish with a dominant flavour such as salmon, sardines, clams, etc 15. Water is traditionally used in chowders such as this and will taste just fine if you opt for that instead of broth 16. If using broth, it is recommended using a sodium reduced variety 17. If you're using canned and don't have enough, you can make up the difference with water 18. The chicken broth adds just a bit of richness to the chowder 19. Chowder is best on the second day, so when entertaining, make it the day before 20. To rewarm , put the pot on low and allow 45 minutes it to heat through 21. Do not allow the chowder to boil 22. Low heat is key 23. You will notice that the spices seem to sit on top of the chowder 24. When you serve, give a little stir and then scoop 25. Just the right amount of spice will come up with the ladle;;
;mayonnaise;1. Brush honey over pancetta slices , heat a skillet over fairly high heat , add a tiny drop of oil and cook pancetta just a few seconds on each side until it gets crispy , drain on paper towels 2. Combine lobster , mango , cucumbers , mayo , salt and pepper to taste 3. In another bowl , mix together lettuce , sun dried tomatoes , and basil 4. Grab some long toothpicks and 2 plates -- you will be stacking 2 sandwiches 5. Spread a little extra mayo on 2 of the toast slices , then top each with the lobster mixture , another piece of toast on top of that , then the lettuce mixture , the pancetta , then the remaining toast pieces 6. Stick 2 long toothpicks into each sandwiches to hold them together , then use a serrated knife to cut each sandwich into halves 7. Remove toothpicks before eating;;
;parmesan cheese;1. Parboil lobster for 7 minues in salted water 2. Remove and cool 3. Place the lobster on its back and use a good sized firm knife 4. Start at the lobsters mouth and quickly slice down the middle of the body and tail 5. Use both hands to open the body and remove the stomach and the tomalley 6. Prepare a stuffing of your choice 7. Fill the body and tail of your lobster with the stuffing mix 8. Preheat oven to 450 degrees f 9. Place the stuffed lobsters on a cookie sheet, and bake for 12-15 minutes or until stuffing is browned;;
Avocado;Kosher Salt;1. Cool sweet potatoes in an ice bath 2. Having cooked bacon in medium skillet, remove and set aside 3. Add sweet potatoes and caramelize on each side 4. Remove from heat 5. Add red onion, mustard, salt, and pepper and toss 6. Chop bacon to 1 / 4 inch strips and mix into hash 7. Fold in parsley, pecans and avocado 8. Season to taste 9. Serve warm to room temperature;;
;Chedder Cheese;1. Prepare grill 2. For each taco, spread 1 / 4 of the cheeses and 4 pcs of the asparagus on each tortilla, then season with salt and pepper 3. Fold in half and lightly brush the outside with olive oil 4. Grill for 3 minutes on each side or until the tortilla is crispy and cheese has melted 5. Add any optional ingredients;;
;Extra Virgin Olive Oil;1. In a medium glass or ceramic bowl, whisk together 2 tablespoons of lime juice and 1 / 2 teaspoon of salt 2. Add tomatoes, avocados, scallions, and garlic 3. Using a rubber spatula, gently fold to combine 4. Season to taste with pepper 5. In large bowl, whisk together olive oil, cumin, remaining tablespoon of lime juice and 1 / 8 teaspoon of salt 6. Add lettuce and toss 7. Season to taste with pepper 8. Divide lettuce among plates 9. Top each with mound of avocado mixture 10. Top with cucumber slices 11. Sprinkle with cilantro and serve;;
;Fresh Lime Juice;1. In a mini chopper, chop the onion, garlic, chili flakes, and lime juice until very fine 2. Mix the chopped ingredients with the fork mashed avocado 3. Meanwhile lightly paint the baguette slices with olive oil on both sides and broil one side then the other until light golden 4. Spread the avocado mixture on the toasted baguette slices 5. Top with the chopped tomatoes and sprinkle with the parmesan cheese 6. Preheat oven to 350f heat for 10 minutes finish under the broiler for 2 more minutes or until the parmesan is golden;;
;Salsa;1. Cut the avocado in half and discard the seed 2. Mash the avocado with the other condiment ingredients in a small bowl , then refrigerate 3. In a medium bowl blend the ground beef with the salsa, fajita seasoning, and tabasco chipotle sauce 4. Divide the burger meat into six portions and make patties 5. Grill the burgers on a charcoal or gas grill 6. Toast the buns on the grill and serve the burgers topped with the cheese and avocado salsa;;
Bacon;Brown Sugar;1. Brown ground beef in skillet, drain off fat and put in crock pot 2. Cut bacon in small pieces 3. Fry bacon and onions till brown 4. Drain off fat 5. Add bacon, onions, and remaining ingredients to crock pot 6. Stir together well 7. Cover and cook on low for 4 to 9 hours 8. If using the 2 quart crock pot, reduce this recipe by half;;
;Sharp Cheddar Cheese;1. Grease 2 1 / 2 qt casserole , layer 1 / 2 potatoes , 1 / 2 onions and 1 / 2 bacon 2. Sprinkle with 1 tbl flour and 1 / 2 salt and pepper 3. Then sprinkle 1 / 2 of each cheese on top 4. Repeat layers, ending with cheese on top 5. Sprinkle chives on top and pour on 1 cup of milk 6. Cover casserole dish and bake at 375 degrees for 1 to 1 / 2 hours, or until potatoes are tender;;
;Paprika;1. Chop onions and celery, if using a food processor dont chop these too fine 2. In a large saucepan, saute onion and celery in 4 ounces of butter until tender 3. Add potatoes and broth, bring to a boil 4. Reduce heat, cover and simmer for 15-20 minutes till potatoes are tender 5. In a small skillet, melt remaining 4 ounces of butter, add flour to make roux, cook roux over low heat until yellow blond in color and set aside 6. To cooked potato and broth mixture, add water, cream and roux stirring continuously until mixture thickens 7. Stir in the cheese, bacon bits, parsley, pepper, and paprika 8. Cook over low heat until the cheese is melted, stir continuously and remove from heat when cheese is melted 9. Garnish with croutons, if desired;;
;Lemon Juice;1. Mix the water and lemon juice in a large bowl 2. Trim the stem and outer layers of the artichokes, leaving only the yellow center of the artichokes 3. Trim the green 4. Cut the artichokes in half and soak in the water mixture 5. Heat olive oil in large frying pan on med-high heat 6. At the same time bring water to boil to cook the spaghetti 7. Saute the onions, garlic, and bacon until the bacon is crispy 8. Add the artichokes and lower heat to medium 9. Continue to cook for about 10 minutes or until artichokes are tender 10. Meanwhile cook pasta until al dente, drain and set aside 11. Whisk the eggs and cheese together 12. Once artichokes are tender add the pasta to the frying pan and stir 13. Stir in the egg mixture, continue to stir until the eggs are cooked 14. Season with salt and pepper and serve;;
;Sour Cream;1. Preheat oven to 350 2. In a blender combine tomatoes, garlic, onion, italian seasoning, salt, and pepper 3. Blend until pureed 4. Set pizza sauce aside 5. In a medium bowl, combine cream cheese, sour cream and 2 ounces of shredded cheese 6. Mix well until well combined 7. Spread cream cheese mixture in an even layer over baking dish 8. Pour blended pizza sauce over cream cheese mixture and evenly distribute with spatula 9. Sprinkle remaining shredded cheese over pizza sauce 10. Top pizza dip with bacon and pepperoni 11. Bake for 20-25 minutes , until cheese is browned and bubbly;;
Beef;Potatoes;1. In a big pot or dutch oven, brown meat in salad dressing 2. Add the next 9 ingredients and bring to a boil 3. Reduce heat and simmer for 1-2 hours or till meat is tender 4. Add the potatoes , carrots , pepper and onion 5. Cover and simmer another hour or until veggies are tender 6. Combine flour and cold water in a shaker , stir into stew and bring to a boil till thickened 7. Serve;;
;Bay Leaf;1. Brown meat and onion 2. Stir in seasonings , soup , tomatoes and rice 3. You may need a little bit of extra water if using brown instant rice 4. Bring to a boil , and then reduce the heat 5. Simmer for 5 to 10 minutes , stirring occasionally , until rice is cooked 6. Serve with sliced olives 7. Salt and pepper to taste;;
;Chili Powder;1. Heat a large nonstick skillet over medium heat 2. Add the ground beef and cook for 8 to 10 minutes , breaking it into 3 / 4 inch or so crumbles and stirring occasionally 3. Drain off the fat 4. Stir in the beans , broth , tomatoes and chili powder , and bring to a boil 5. Reduce heat , cover and simmer 20 minutes to develop flavors , stirring occasionally 6. Serve with toppings , as desired;;
;Cornstarch;1. Combine the first six ingredients then divide in half 2. Add beef to half of marinade and let it sit at least 1 hour at room temperature 3. Reserve remaining marinade for cooking later 4. Bring water to a boil 5. Add rice, reduce heat to just below medium, and cook 38 min then let it sit 15 min without opening the lid 6. Drain the  meat, discarding marinade 7. Heat oil over med-high heat 1 min then add sesame seeds and continue to heat 1 min more, stirring 8. Add beef to pan and cook, stirring gently, 4 min or so until beef is mostly cooked 9. Combine cornstarch and fresh, unused marinade and pour over cooked beef 10. Cook 1 min, stirring, then remove from heat 11. To partly cooled rice, add soy sauce, vinegar, honey, and ginger 12. Stir 13. To assemble wraps, layer rice, beef, beans, onions, cucumber, carrots, avocado, and cilantro on leaf of lettuce and roll up;;
;Tomato Paste;1. Brown the sausage and ground meat and drain all the fat 2. Add all the other ingredients for the meat filling and simmer on the stove , uncovered, for about 1 / 2 hour 3. I usually add a bay leaf or two 4. Mix up the cheese filling and set aside in fridge until ready to use 5. Put the noodles in salted water and cook until soft when poked with a fork 6. When the noodles are done  drain the noodles and rinse off with cold water so they can be handled easily 7. Spray the baking pan with a non-stick spray and put a layer of noodles down on the bottom of the pan 8. It is ok to cut some of the noodles to fit into the pan if they do not fit whole 9. Spread half the cheese filling over the noodles, then half of the mozarella cheese on top of that, then half of the meat sauce over the grated mozarella cheese 10. Repeat layers and then top with more mozarella cheese 11. Bake at 375 degrees for 30 minutes 12. Let it stand for 10 minutes before cutting into it 13. Leftovers can be easily stored in the freezer;;
Bell Pepper;Soy Sauce;"1. In the frying pan, melt butter 2. Add teaspoons of seasoning and the noodles 3. Saute 2 minutes, stirring 4. Set aside on paper towel 5. Meanwhile, in a bowl, combine coleslaw mix, kernels, green onions, and red bell pepper 6. Toss, cover, and refrigerate 30 minutes to 1 hour before serving 7. In a small bowl, whisk the rest of the ingredients well til syrupy 8. Pour over salad, stir well, and refrigerate 9. Just before serving, stir in noodles 10. Variations: Sub or add toasted, slivered, or chopped almonds in place of or in addition to sunflower kernels 11. For a complete ""one-dish"" lunch or meal, stir cooked, diced chicken in 2-3 cups";;
;Wide Egg Noodles;1. Set oven to 350 degrees 2. Butter a 3-quart casserole dish 3. Cook the egg noodles in boiling water with 1 tablespoon salt until al dente 4. Drain then place in a large bowl and toss with 1 tablespoon butter or oil , set aside 5. In a large skillet melt butter over medium heat 6. Add in onion , garlic , bell pepper , celery and jalapeno pepper 7. Saute for 4-5 minutes or until tender 8. Add in soup , half and half or milk , cooked chicken and seaoned salt 9. Bring to a simmer over medium heat stirring with a wooden spoon until heated through and well combined 10. Add the chicken mixture to the cooked noodles in the bowl 11. Toss to combine then season with black pepper to taste and more salt if desired 12. Transfer to a buttered casserole dish 13. In a bowl mix together breadcrumbs with parmesan cheese then sprinkle evenly over casserole 14. Bake for about 20-25 minutes or until heated through and the topping is golden brown;;
;Sesame Oil;1. In large skillet saut ground chicken / turkey over medium heat , crumbling and cooking until no longer pink 2. Pour into dish , set aside 3. Rinse out pan 4. Saut bell pepper , onion , garlic and ginger for 2 minutes 5. Add meat to pan 6. In small bowl , blend lemon juice , hoisin sauce , brown sugar , sesame oil , soy sauce and hot pepper sauce 7. Pour into pan and stir to coat chicken 8. Reduce heat and simmer , stirring until sauce is absorbed , about 4 minutes 9. Stir in chopped cilantro 10. Serve with lettuce cups;;
;Eggs;1. Stir together first 12 ingredients in a large bowl , just until combined 2. Shape mixture into 2 loaves 3. Place in an aluminum foil lined broiler pan 4. Pour half of tomato sauce evenly over each loaf , and arrange 2 bacon slices over each loaf 5. Bake at 350f for 1 hour 6. Let meat loaf stand 10 minutes before serving;;
;Black Pepper;1. In salad bowl, combine oil, vinegar, garlic, salt, basil, and black pepper 2. Add beans, tuna, scallions, and sweet pepper and toss 3. Chill several hours for flavors to blend 4. To make a beautiful presentation, serve on a leaf of bibb lettuce;;
Broccoli;Olive Oil;1. Brown and crumble sausage in a skillet 2. Wash and chop greens 3. Remove sausage from pan and drain on paper towels 4. Wipe out skillet 5. Heat olive oil in skillet and saute garlic 6. Add greens to skillet 7. Cook uncovered till wilted down 8. Add 1 / 3 cup water to skillet 9. Cook on low heat covered till greens are tender 10. Add the sausage back into the cooked greens 11. Set aside 1 / 2 cup to 1 cup of the greens sausage mixture for the top 12. Mix cottage cheese, ricotta, pesto, and egg together 13. Salt and pepper to taste 14. Line the bottom of a lasagna pan with the lasagna noodles 15. Put half of the sausage / greens mixture on top of noodles followed by ricotta mixture 16. Layer with more lasagna noodles 17. Top with sausage / greens mixture followed by remaining ricotta mixture 18. Place another layer of noodles on top 19. Cover with monzerella cheese , reserved sausage / greens mixture and pine nuts if desired 20. Bake for 1 / 2 hour till melty and bubbly;;
;Butter;1. Preheat oven to 350 degrees 2. Coat the bottom of the two small or one medium baking dish with a thin layer of alfredo sauce 3. In a medium bowl, mix the pasta, broccoli, mushrooms, chicken, garlic, and alfredo sauce until combined 4. Place mixture into baking dish and top with mozzarella and parmesan cheese 5. Cut the butter into small pieces and scatter on top of the cheese 6. Bake for 20 minutes or until cheese is hot and bubbly;;
;Lemon Juice;1. Put the first 12 ingredients in a large pot 2. Cover and bring to a boil over high heat 3. Reduce heat to a simmer and simmer partly covered for 10 minutes or until vegetables are tender 4. Leave veggies whole or use an immersion blender and puree a bit -- leaving some veggie chunks 5. Stir in parsley and season with salt, pepper, and lemon juice;;
;Soy Sauce;1. Preheat oven to 425 degrees F 2. Place chicken tenders on a rimmed baking sheet and transfer to oven 3. Bake until very crispy and golden, about 10 minutes beyond recommended bake time on the package 4. Reduce heat to 200 degrees F to keep tenders warm until ready to serve 5. Meanwhile, fill a medium pot fit with a steamer insert with 1-inch of water 6. Place over medium-high heat and when water boils, add broccoli and season with salt 7. Cover, and steam until broccoli is tender, for about 8 minutes 8. Keep warm 9. Place cornstarch in a medium bowl 10. Add rice wine vinegar, soy sauce, honey, chile flakes, and 3 tablespoons of water and whisk to combine 11. Set aside 12. Place a small skillet over medium heat and add sesame oil 13. When shimmering, add garlic and ginger and saute until softened for about 2 minutes 14. Add cornstarch mixture and cook, whisking constantly, until mixture comes to a boil and thickens for about 1-2 minutes 15. Remove from heat and keep warm 16. Remove chicken tenders from oven and transfer to a large mixing bowl 17. Add the broccoli, sauce, and toss to coat 18. Serve with white rice on the side, topped with scallions and toasted sesame seeds;;
